no,teks,sosmed,lebels;
"514,""sekarang berambisi mau punya pekerjaan yang bayaran 2 digit, tapi gamau berusaha"",x,Negatif";
"515,""temenku banyak yang membandingkan pekerjaan, tanpa disadari mereka tidak bersyukur dengan kerjaannya saat ini"",x,Negatif";
"516,""kenapa sih gen z gabisa bersyukur, dikit2 ngeluh gajinya dikit kebutuhannya banyak"",x,Negatif";
"517,""saya mempunyai karyawan genz jarang masuk kerja,alasan sakit mulu"",x,Negatif";
"518,""generasi sekarang gada etika berpakaian atau gimana sih? Kebanyakan keliatan pusarnya , apa gamalu mereka?"",x,Negatif";
519,Saya kagum melihat bagaimana Gen Z mampu menjaga kerja sama sambil tetap konsisten dalam menghadapi tantangan kerja.,x,Positif;
520,turut berduka cita atas generasi sekarang karena tolol gada etikanya sama orang tua,x,Negatif;
"521,""kemaren liat cuplikan di reels ada anak sma yang minta uang jajan sekolah sama orang tuanya, Cuma minta aja gada berpamitan bersalaman dengan orangtua mereka, emng gen z sekarang gada etikanya"",x,Negatif";
"522,""generasi sekarang lebih mentingin diri sendiri, mau di mintai tolong mereka malah cuek emng dasar genx"",x,Negatif";
"523,""Generasi Z membawa semangat baru ke dunia kerja, mengedepankan integritas dan transparansi bahkan di lingkungan yang luar biasa."",x,Negatif";
524,Generasi Z menunjukkan etika kerja yang efisien dengan semangat inovatif dan kemauan belajar yang adaptif.,x,Positif;
525,etika bekerja generasi milenial lebih bagus dari pada generasi z,x,Negatif;
"526,""GEN Z  akan menjadi generasi miskin di masa depan   jika gaya hidup dan gengsi nya lebih tinggi, dan terus di pertahankan"",x,Negatif";
527,memang benar genz mudah baper,x,Negatif;
528,Setuju.. genarasi paling ancur,x,Negatif;
"529,""Ketekunan dan dedikasi Generasi Z patut diacungi jempol, mereka bekerja dengan profesionalisme dan punya kerja sama tinggi."",x,Positif";
530,pakk nyerah kerja bareng genz,x,Negatif;
531,kalo boleh saran genz jangan dikasih kerja an yang berat. Isinya ngeluh aja nanti,x,Negatif;
"532,""mahasiswa gada etikanya ngechat dosen jam 12 malam, ati ati nanti kebawa waktu kerja"",x,Negatif";
"533,""tepat waktu saat masuk kerja, termasuk etika kerja"",x,Negatif";
"534,""Ketekunan dan dedikasi Generasi Z patut diacungi jempol, mereka bekerja dengan kejujuran dan punya tanggung jawab tinggi."",x,Positif";
535,Etika kerja Generasi Z tercermin dari komitmen mereka untuk terus beradaptasi dan meningkatkan diri bagi tim.,x,Positif;
"536,""Saya bukan gen Z dan saya tidak setuju kalau mereka mendapatkan julukan generasi tempe. Tempe punya karakteristik yang berbeda dengan pemaparan dalam video ini. Menurut saya lebih cocok jika julukannya generasi indomie. Serba instan, kesenangan sesaat (short termist) dan health hazard."",x,Positif";
"537,""@@jaizalthehermit Berarti lingkungan disitu gak baik,, ditempat saya baik kok. Terus mau anda gimana??? Kalau tidak ada orang baik jadilah anda salah satunya"",x,Positif";
"538,""Etika kerja Generasi Z sering kali terlihat tidak konsisten, terutama saat menghadapi tekanan dan tenggat waktu."",x,Negatif";
"539,""Katanya Gen Z punya profesionalisme, tapi kadang fleksibilitas mereka malah bikin kerjaan jadi berantakan."",x,Negatif";
540,Generasi Z tampaknya lebih sibuk dengan tampilan kreatifnya ketimbang benar-benar menyelesaikan tugas dengan tuntas.,x,Negatif;
"541,""Semangat belajar mereka kadang cuma sebatas wacana, karena saat diuji justru cepat kehilangan fokus."",x,Negatif";
"542,""Gen Z sering ngomong soal transparansi, tapi saat remote kerja, koordinasi mereka malah sering kacau."",x,Negatif";
543,Klaim adaptif dan inovatif dari Gen Z seringnya cuma alasan buat menghindar dari tanggung jawab sebenarnya.,x,Negatif;
"544,""Komitmen mereka kadang cuma di atas kertas, sementara di praktik nyata malah sering keteteran."",x,Negatif";
"545,""Etika digital yang diklaim Generasi Z, terkadang berujung pada terlalu asyik main gadget sampai lupa kerja."",x,Negatif";
"546,""Mereka pamer semangat positif, tapi saat kondisi sulit malah gampang menyerah dan cari alasan."",x,Negatif";
547,Gen Z seringkali lebih mengutamakan gaya daripada substansi dalam menunjukkan profesionalisme.,x,Negatif;
"548,""Generasi Z sering terlihat kurang konsisten dalam mempertahankan etika kerja, sehingga semangat positif mereka cepat memudar saat menghadapi tekanan."",x,Negatif";
549,Saya liat tuh gampang emosian...,x,Negatif;
550,@Grrrrr1230987 @sosmedkeras benar sekali. FYI mitra kerja sy - ada kok GenZ yg MANTAP - tapi maaf rata¬¨‚â§ mereka disiplin jarang main gadget (kecuali utk promosi) produktif (tapi ya itu sedikit sekali). Tetap Semangat kami dulu pun dicaci maki tpi langs,x,Positif;